Malay Comments,Google Translate,Bing Translate
sangat tidak memuaskan..staff sangat kurang ajar..bilik yang tidak selesa...walaupun lebih baik tambah duit lebih sikit sewa tempat lain ,very poor .. very rude staff .. rooms are not comfortable ... even better add a little bit more money elsewhere rentals,"very unsatisfactory ...staff very rude ...the rooms are not comfortable ... even better add a little bit more money, rent somewhere else"
"Kualiti bilik lemah, air berkarat - perlu buka paip selama 15-20 minit sebelum air cerah semula, tidak banyak lampu di luar pada waktu malam - ada lampu terbakar. Kabinet pecah, pintu almari baju hamper runtuh.","Poor room quality, rusty water - have to turn the tap on for 15-20 minutes before water is bright again, not many lights off at night - no lights burning. Cabinet burst, collapse hampers closet door.","The quality of the room, rusty water-need to open the tap for 15-20 minutes before bright water again, not much light outside at night-there's a burning lamp. Broken Cabinet, closet door clothes hamper collapsed."
"Katil yang di gunakan adalah rak katil. Sakit badan apabila tidur di atasnya
",Beds are in use is a bed rack. Sore body when sleeping on it,A Bed in use are the shelves of the bed. The body's pain when sleeping on it
Tidak menyenangkan. Kotor dan bau yang kurang enak,Not fun. Dirty and unpleasant odors,Not fun. Dirty and smell the less tasty
hawa dingin tidak berfungsi dengan baik...sungguh mengecewakan...cadar terlalu buruk dan tidak selesa...,Air-conditioning does not work well ... very disappointing ... too bad sheets and uncomfortable ...,air conditioning did not work properly ... so frustrating ... sheets too bad and uncomfortable ...
"access card parking tidak boleh guna, kena turun naik office untuk keluar park. apartment sekadar boleh tidur sahaja, dekat bawah blok,time balik pukul 12 ada hooker menunggu untuk extra service.","parking access card is not in use, due to fluctuations in the office to get out of park. apartment just to sleep alone, close down the block, some time back at 12 hooker waiting for the extra service.","access card parking cannot use, be fluctuations in office to leave park. apartment just can sleep alone, near the bottom of the block, time back by 12 there is a hooker waiting for extra service."
Bilik dan dapur yang sangat teruk..berbau busuk. langsung tidak dijaga..harga tidak berbaloi..tidak digalakkan untuk tinggal disini..,Cubicles and kitchens are very excessive .. stink. not directly maintained .. the price is not berbaloi .. not encouraged to stay here ..,The room and the kitchen are very badly ...stinks. never taken care of ...the price is not worth it ...not recommended to stay here ...
Perlu disediakan kawasan letak kereta secukupnya utk kemudahan pengunjung.,Necessary to provide sufficient area train layout For visitor convenience.,Need parking area enough for visitors.
segalanya OK kecuali ada tikus kecil di dalam bilik,everything is ok except there is a small rat in the chamber,everything OK except some small rats in the room
"Bilik kecil dan selimut yang nipis...ada banyak nyamuk.Di dalam bilik tidak boleh merokok dan denda rm5 untuk merokok ini tidak diberitahu ketika check-in. 
Layanan pekerja bagus tapi lalai krn minta buat wake-up call tak buat. Tgh malam agak sukar nak cari kedai minum sbb kedai tutup awal",Small room and a light blanket ... there's a lot of room nyamuk.Di not smoke and fined RM5 for smoking is not notified when check-in. Services are nice but the default krn workers ask for a wake-up call is not made. TGH night want to find a little difficult to drink shop closed shop early intrauterine ,"""Small and thin blankets ... There are many mosquitoes.In the room should not be smoking and fine rm5 to smoke is not notified when check-in. employees Service good but default krn was last requested wake-up call is made. Midnight is quite difficult to find drinking sbb shop closes early """
